{
  "meta": {
    "title": "清华食堂吃饭指南 · 结构化数据",
    "subtitle": "不同饭堂 + 楼层 + 菜系的菜品数据，用于“今天吃什么”抽签与菜系推荐",
    "version": "1.0.0",
    "generatedAt": "2026-09-20",
    "generator": "tools/build_menu_data.py",
    "origin": {
      "platform": "小红书",
      "account": "饭饭推荐（小红书号 7411829636，页面水印）",
      "collection": "清华食堂吃饭指南（食堂安利）",
      "images": [
        "微信图片_20260920160529_3_10.jpg",
        "微信图片_20260920160530_4_10.jpg",
        "微信图片_20260920160531_5_10.jpg",
        "微信图片_20260920160532_6_10.jpg",
        "微信图片_20260920160533_7_10.jpg",
        "微信图片_20260920160534_8_10.jpg",
        "微信图片_20260920160535_9_10.jpg",
        "微信图片_20260920160536_10_10.jpg",
        "微信图片_20260920160537_11_10.jpg",
        "微信图片_20260920160539_12_10.jpg",
        "微信图片_20260920160540_13_10.jpg",
        "微信图片_20260920160541_14_10.jpg",
        "微信图片_20260920160542_15_10.jpg",
        "微信图片_20260920160543_16_10.jpg",
        "微信图片_20260920160544_17_10.jpg",
        "微信图片_20260920160545_18_10.jpg",
        "微信图片_20260920160546_19_10.jpg",
        "微信图片_20260920160546_20_10.jpg",
        "微信图片_20260920160600_34_10.jpg"
      ],
      "imageCount": 19
    },
    "posts": [
      {
        "id": "A13",
        "title": "食堂安利 · 清华食堂吃饭指南（13 张系列）",
        "totalPages": 13,
        "pagesPresent": [
          2,
          3,
          4,
          5,
          6,
          7,
          8,
          9,
          10,
          11,
          12,
          13
        ],
        "pagesMissing": [
          1
        ]
      },
      {
        "id": "B13",
        "title": "食堂安利 · 清华食堂吃饭指南（另一套 13 张系列，仅见第 2 张）",
        "totalPages": 13,
        "pagesPresent": [
          2
        ],
        "pagesMissing": [
          1,
          3,
          4,
          5,
          6,
          7,
          8,
          9,
          10,
          11,
          12,
          13
        ]
      },
      {
        "id": "C9",
        "title": "食堂安利 · 清华食堂吃饭指南（9 张系列）",
        "totalPages": 9,
        "pagesPresent": [
          4,
          5,
          6,
          7,
          8,
          9
        ],
        "pagesMissing": [
          1,
          2,
          3
        ]
      }
    ],
    "fieldNotes": {
      "id": "饭堂前缀 + 两位序号，稳定不变，可作小程序端主键",
      "floor": "截图里明确标注的楼层，未标注则为 null",
      "floorSource": "section = 来自截图橙色分区标题；window = 分区未标楼层，从窗口原文推断（仅澜园椒麻鸡，窗口写“一楼米饭自选”）",
      "stallName": "截图里“窗口：”后面的原文（保留口语化描述）",
      "price.text": "截图徽章原文，未经改写",
      "price.min/max": "由徽章解析出的价格区间；approx=左右/大概，uncertain=带问号或“忘了”",
      "reviewLevel": "帖子自带的评价标签（好评/强烈推荐/两极/信息较少/差评/已停业/值得一试）",
      "drawWeight": "抽签权重，来自 reviewLevel：强烈推荐 5、好评/值得一试 3、两极 1.5、信息较少 1、差评与已停业 0",
      "spicyLevel": "0 不辣 / 1 微辣 / 2 中辣 / 3 重辣"
    },
    "caveats": [
      "数据来自小红书个人分享，价格为截图时点价格，可能已变动。",
      "两张截图都标注“第 2/13 张”（荷园、紫荆园），说明存在两套 13 张系列的帖子；本数据集把它们区分为 A13 / B13。",
      "缺失页：A13 缺第 1 张，B13 只有第 2 张，C9 缺第 1-3 张。",
      "校名是“清青快餐/清青牛拉/清青咖啡/清青永和”，截图中易误读为“清清”，本数据集已按“清青”录入。",
      "跟帖提到 C 楼蜜雪冰城已撤出、独峰书院已停业，相关记录标记为可能过时/已停业。",
      "“（窗口整体推荐）”类记录 type = stall_recommendation，默认不参与抽签，只作窗口级推荐展示。"
    ],
    "stats": {
      "canteenCount": 17,
      "canteenWithFloorCount": 7,
      "floorCount": 10,
      "dishCount": 72,
      "dishRecordCount": 72,
      "recommendableDishCount": 70,
      "stallRecommendationCount": 2,
      "cuisineCount": 24,
      "usedCuisineCount": 24,
      "sourceImageCount": 19,
      "pricedDishCount": 62,
      "unknownPriceDishCount": 10,
      "noReviewCount": 3
    }
  },
  "taxonomy": {
    "cuisines": [
      {
        "id": "sichuan",
        "name": "川菜（麻辣）",
        "group": "中餐",
        "emoji": "🌶️",
        "keywords": [
          "麻辣",
          "椒麻",
          "水煮",
          "藤椒",
          "香辣"
        ]
      },
      {
        "id": "cantonese",
        "name": "粤菜（广式）",
        "group": "中餐",
        "emoji": "🦆",
        "keywords": [
          "烧腊",
          "白切鸡",
          "叉烧",
          "肠粉",
          "煲仔饭"
        ]
      },
      {
        "id": "jiangzhe",
        "name": "江浙菜（杭帮·淮扬）",
        "group": "中餐",
        "emoji": "🍤",
        "keywords": [
          "龙井虾仁",
          "响油鳝糊",
          "蟹黄豆腐",
          "青团"
        ]
      },
      {
        "id": "beijing",
        "name": "京菜（烤鸭·葱爆）",
        "group": "中餐",
        "emoji": "🦆",
        "keywords": [
          "北京烤鸭",
          "葱爆羊肉"
        ]
      },
      {
        "id": "northeast",
        "name": "东北菜（麻辣拌·烤冷面）",
        "group": "中餐",
        "emoji": "🥟",
        "keywords": [
          "麻辣拌",
          "烤冷面",
          "粘豆包",
          "饺子"
        ]
      },
      {
        "id": "homestyle",
        "name": "家常菜（红烧·糖醋·炖汤）",
        "group": "中餐",
        "emoji": "🍲",
        "keywords": [
          "红烧",
          "糖醋",
          "瓦罐汤",
          "家常小炒"
        ]
      },
      {
        "id": "northwest",
        "name": "西北面食（陕甘）",
        "group": "主食",
        "emoji": "🍜",
        "keywords": [
          "肉夹馍",
          "油泼面",
          "烩面",
          "炒面片",
          "拉条"
        ]
      },
      {
        "id": "halal",
        "name": "清真·牛肉面",
        "group": "主食",
        "emoji": "🐮",
        "keywords": [
          "牛肉拉面",
          "炒面片",
          "烩面"
        ]
      },
      {
        "id": "noodles",
        "name": "面食·粉面",
        "group": "主食",
        "emoji": "🍜",
        "keywords": [
          "拉面",
          "拌面",
          "米线",
          "米粉",
          "面片",
          "汤面"
        ]
      },
      {
        "id": "rice",
        "name": "米饭·盖饭·拌饭",
        "group": "主食",
        "emoji": "🍚",
        "keywords": [
          "炒饭",
          "盖饭",
          "拌饭",
          "石锅饭"
        ]
      },
      {
        "id": "hotpot",
        "name": "香锅·锅仔·冒菜",
        "group": "中餐",
        "emoji": "🥘",
        "keywords": [
          "麻辣香锅",
          "锅仔",
          "冒菜",
          "麻辣烫"
        ]
      },
      {
        "id": "korean",
        "name": "韩式",
        "group": "异国",
        "emoji": "🇰🇷",
        "keywords": [
          "石锅拌饭",
          "辣白菜",
          "芝士铁板鸡"
        ]
      },
      {
        "id": "japanese",
        "name": "日式（照烧·咖喱）",
        "group": "异国",
        "emoji": "🍛",
        "keywords": [
          "照烧",
          "咖喱",
          "日式简餐"
        ]
      },
      {
        "id": "taiwanese",
        "name": "台式",
        "group": "中餐",
        "emoji": "🍗",
        "keywords": [
          "三杯鸡",
          "台式小吃"
        ]
      },
      {
        "id": "minnan",
        "name": "闽台菜（沙茶）",
        "group": "中餐",
        "emoji": "🥜",
        "keywords": [
          "沙茶面",
          "福建风味"
        ]
      },
      {
        "id": "thai",
        "name": "泰式·东南亚",
        "group": "异国",
        "emoji": "🍋",
        "keywords": [
          "香茅",
          "冬阴功",
          "泰式沙拉"
        ]
      },
      {
        "id": "western",
        "name": "西式简餐（披萨·意面·汤）",
        "group": "西式",
        "emoji": "🍕",
        "keywords": [
          "披萨",
          "意面",
          "奶油汤",
          "西式小食"
        ]
      },
      {
        "id": "burger",
        "name": "汉堡·西式快餐",
        "group": "西式",
        "emoji": "🍔",
        "keywords": [
          "汉堡",
          "薯条",
          "炸物套餐"
        ]
      },
      {
        "id": "grill",
        "name": "铁板·烧烤·炸物",
        "group": "小吃",
        "emoji": "🍢",
        "keywords": [
          "铁板饭",
          "炸鸡",
          "烤翅",
          "烧烤"
        ]
      },
      {
        "id": "light",
        "name": "清淡·轻食·沙拉",
        "group": "健康",
        "emoji": "🥗",
        "keywords": [
          "清淡",
          "轻食",
          "沙拉",
          "清汤"
        ]
      },
      {
        "id": "breakfast",
        "name": "早餐·包子·糕点",
        "group": "小吃",
        "emoji": "🥟",
        "keywords": [
          "包子",
          "豆浆",
          "煎饼",
          "肠粉"
        ]
      },
      {
        "id": "snacks",
        "name": "小吃·点心",
        "group": "小吃",
        "emoji": "🥠",
        "keywords": [
          "肉夹馍",
          "锅贴",
          "抄手",
          "青团",
          "饺子"
        ]
      },
      {
        "id": "dessert",
        "name": "甜品·冰淇淋",
        "group": "甜品饮品",
        "emoji": "🍦",
        "keywords": [
          "冰淇淋",
          "芭菲",
          "圣代",
          "青团甜点"
        ]
      },
      {
        "id": "drinks",
        "name": "饮品·豆浆·咖啡",
        "group": "甜品饮品",
        "emoji": "🥤",
        "keywords": [
          "豆浆",
          "现调饮品",
          "咖啡",
          "果汁"
        ]
      }
    ],
    "tags": [
      {
        "id": "",
        "name": "校内公认好吃",
        "polarity": "好评",
        "description": "帖子里明确说“校内最好吃/公认最好”"
      },
      {
        "id": "",
        "name": "必点",
        "polarity": "好评",
        "description": "被称作某食堂必点"
      },
      {
        "id": "",
        "name": "性价比高",
        "polarity": "好评",
        "description": "价格与分量/口味比值被点名"
      },
      {
        "id": "",
        "name": "量大",
        "polarity": "好评",
        "description": "分量被点名足"
      },
      {
        "id": "",
        "name": "清淡",
        "polarity": "好评",
        "description": "口味清淡不重口"
      },
      {
        "id": "",
        "name": "汤品",
        "polarity": "中性",
        "description": "汤类"
      },
      {
        "id": "",
        "name": "现做",
        "polarity": "好评",
        "description": "现点现做"
      },
      {
        "id": "",
        "name": "现磨",
        "polarity": "好评",
        "description": "现磨饮品"
      },
      {
        "id": "",
        "name": "可点半份",
        "polarity": "好评",
        "description": "可以点半份"
      },
      {
        "id": "",
        "name": "自选",
        "polarity": "中性",
        "description": "自选称重/自选窗口"
      },
      {
        "id": "",
        "name": "轻食",
        "polarity": "好评",
        "description": "轻食沙拉类"
      },
      {
        "id": "",
        "name": "甜口",
        "polarity": "中性",
        "description": "偏甜口味"
      },
      {
        "id": "",